{
  "schemaVersion": 1,
  "programCount": 16,
  "validProgramCount": 16,
  "programs": [
    {
      "programId": "discard-to-trash",
      "obligation": "discard_to_trash",
      "evidenceRuleIds": [
        "422",
        "422.1",
        "422.1.a",
        "422.1.b"
      ],
      "sourceTextGuards": {
        "422": "Discard",
        "422.1": "Discarding a card is moving it from a player's hand directly into their trash without activating or executing its normal rules text.",
        "422.1.a": "The player who is performing the action chooses which cards to send to their Trash, and may use Private Information to do so.",
        "422.1.b": "“When I am discarded” abilities or other Triggered Abilities that trigger on discarding are executed after discarding has occurred."
      },
      "cases": [
        {
          "when": [],
          "verdict": "yes",
          "truth": "true",
          "claim": "Discarding a card moves it directly from its player's hand to that player's Trash without executing the card's normal rules text.",
          "evidenceRuleIds": [
            "422",
            "422.1",
            "422.1.a",
            "422.1.b"
          ]
        }
      ],
      "fallback": null,
      "sourceTextGuardHashes": {
        "422": {
          "expectedTextHash": "eb1a70e39274bb762b5d7c1adb5debeea2b05e12af28207f21a375b596853273",
          "actualTextHash": "eb1a70e39274bb762b5d7c1adb5debeea2b05e12af28207f21a375b596853273"
        },
        "422.1": {
          "expectedTextHash": "9a0b5bc199069166d060f0802cb9fdc3a67a336396a017a9f72eb1353dcdd15a",
          "actualTextHash": "9a0b5bc199069166d060f0802cb9fdc3a67a336396a017a9f72eb1353dcdd15a"
        },
        "422.1.a": {
          "expectedTextHash": "fe36604f6b7762db5f86c0f8d22e66e41e4a0c1853b5a60962063d0ad6e6e7fc",
          "actualTextHash": "fe36604f6b7762db5f86c0f8d22e66e41e4a0c1853b5a60962063d0ad6e6e7fc"
        },
        "422.1.b": {
          "expectedTextHash": "6853a768ad21e2198b0b4608d273632e0d54aa98a4f0d1a9eb7b40f2ca19ec3f",
          "actualTextHash": "6853a768ad21e2198b0b4608d273632e0d54aa98a4f0d1a9eb7b40f2ca19ec3f"
        }
      },
      "valid": true,
      "executable": true,
      "validationErrors": [],
      "compilerVersion": 1
    },
    {
      "programId": "replace-not-play",
      "obligation": "replacement_not_play",
      "evidenceRuleIds": [
        "438",
        "438.1"
      ],
      "sourceTextGuards": {
        "438": "Replace",
        "438.1": "Replacing is the act of Creating a token in the place of another card or token without playing it while inheriting all effects or statuses of the game object it replaced."
      },
      "cases": [
        {
          "when": [],
          "verdict": "no",
          "truth": "true",
          "claim": "Replacing creates a token in another object's place without playing that token.",
          "evidenceRuleIds": [
            "438",
            "438.1"
          ]
        }
      ],
      "fallback": null,
      "sourceTextGuardHashes": {
        "438": {
          "expectedTextHash": "95e154398a4bc0091aa4d6b607472ac5a89e41fbc84a3a49f823314d6de9eebc",
          "actualTextHash": "95e154398a4bc0091aa4d6b607472ac5a89e41fbc84a3a49f823314d6de9eebc"
        },
        "438.1": {
          "expectedTextHash": "fb94bcb38b115544a4870bb61db72b87efe96abaa66b8156f23d67a789db1fd8",
          "actualTextHash": "fb94bcb38b115544a4870bb61db72b87efe96abaa66b8156f23d67a789db1fd8"
        }
      },
      "valid": true,
      "executable": true,
      "validationErrors": [],
      "compilerVersion": 1
    },
    {
      "programId": "ready-binary-state",
      "obligation": "ready_state",
      "evidenceRuleIds": [
        "415.1",
        "415.1.b",
        "415.1.c"
      ],
      "sourceTextGuards": {
        "415.1": "Readying is an action that marks a non-spell Game Object on the board as available for action.",
        "415.1.b": "A Unit that is already Ready cannot be Readied again.",
        "415.1.c": "If a Unit is instructed to be Readied while it is already Ready, nothing additional happens."
      },
      "cases": [
        {
          "when": [
            {
              "fact": "unit_already_ready",
              "op": "is_true"
            }
          ],
          "verdict": "no",
          "truth": "true",
          "claim": "An already Ready Unit cannot be Readied again; an instruction to Ready it causes nothing additional to happen, so there is no new Ready event from that instruction.",
          "evidenceRuleIds": [
            "415.1",
            "415.1.b",
            "415.1.c"
          ],
          "applicabilityRuleId": "415.1.b"
        }
      ],
      "fallback": {
        "verdict": "conditional",
        "truth": "unknown",
        "claim": "This compiled ruling only resolves the already-Ready case; the question does not establish that state.",
        "evidenceRuleIds": [
          "415.1",
          "415.1.b",
          "415.1.c"
        ]
      },
      "sourceTextGuardHashes": {
        "415.1": {
          "expectedTextHash": "65eeb80253baa19efd1d214a1afed8a71d4901b8ab780e44465c458bba6e3bf3",
          "actualTextHash": "65eeb80253baa19efd1d214a1afed8a71d4901b8ab780e44465c458bba6e3bf3"
        },
        "415.1.b": {
          "expectedTextHash": "b2dc58f574f44b807ced33bdbccdecc8afe8720fba8b0c86abb7c538e22956c7",
          "actualTextHash": "b2dc58f574f44b807ced33bdbccdecc8afe8720fba8b0c86abb7c538e22956c7"
        },
        "415.1.c": {
          "expectedTextHash": "a936a2f2f48a95872cc5f7e55e215d8281a62b8c65b1ddb487e0965090a39124",
          "actualTextHash": "a936a2f2f48a95872cc5f7e55e215d8281a62b8c65b1ddb487e0965090a39124"
        }
      },
      "valid": true,
      "executable": true,
      "validationErrors": [],
      "compilerVersion": 1
    },
    {
      "programId": "exhaust-binary-state-and-cost",
      "obligation": "exhaust_state",
      "evidenceRuleIds": [
        "414.1",
        "414.1.b",
        "414.1.c",
        "414.4"
      ],
      "sourceTextGuards": {
        "414.1": "Exhausting is an action that marks a non-spell Game Object on the board as \"spent.\"",
        "414.1.b": "A Game Object that is already Exhausted cannot be Exhausted again.",
        "414.1.c": "If a Game Object is instructed to be Exhausted while it is already Exhausted, nothing additional happens.",
        "414.4": "When Exhausting is listed as a Cost, then the Action must be able to be completed for the cost to be paid."
      },
      "cases": [
        {
          "when": [
            {
              "fact": "object_already_exhausted",
              "op": "is_true"
            },
            {
              "fact": "exhaust_is_cost",
              "op": "is_true"
            }
          ],
          "verdict": "no",
          "truth": "true",
          "claim": "An already Exhausted Game Object cannot be Exhausted again, so an Exhaust cost cannot be paid with it because the required action cannot be completed.",
          "evidenceRuleIds": [
            "414.1",
            "414.1.b",
            "414.1.c",
            "414.4"
          ],
          "applicabilityRuleId": "414.4"
        },
        {
          "when": [
            {
              "fact": "object_already_exhausted",
              "op": "is_true"
            }
          ],
          "verdict": "no",
          "truth": "true",
          "claim": "An already Exhausted Game Object cannot be Exhausted again; an instruction to Exhaust it causes nothing additional to happen.",
          "evidenceRuleIds": [
            "414.1",
            "414.1.b",
            "414.1.c"
          ],
          "applicabilityRuleId": "414.1.b"
        }
      ],
      "fallback": {
        "verdict": "conditional",
        "truth": "unknown",
        "claim": "Whether this Exhaust instruction or cost can be performed depends on the object's current Exhausted state and whether Exhaust is being paid as a cost.",
        "evidenceRuleIds": [
          "414.1.b",
          "414.1.c",
          "414.4"
        ]
      },
      "sourceTextGuardHashes": {
        "414.1": {
          "expectedTextHash": "2407af5471fae88e048a141ffe4549b1078b8b68d3add0d17210f3f07030f3f9",
          "actualTextHash": "2407af5471fae88e048a141ffe4549b1078b8b68d3add0d17210f3f07030f3f9"
        },
        "414.1.b": {
          "expectedTextHash": "33a0f58b5498adb2f7e3d4bed7eba21268c3f07f9c4ddbd2b5e0375527a9e561",
          "actualTextHash": "33a0f58b5498adb2f7e3d4bed7eba21268c3f07f9c4ddbd2b5e0375527a9e561"
        },
        "414.1.c": {
          "expectedTextHash": "7803b5da21658ae3e807bd4c8b761bb3213dd936de4deb049863bfaaf65a5e9d",
          "actualTextHash": "7803b5da21658ae3e807bd4c8b761bb3213dd936de4deb049863bfaaf65a5e9d"
        },
        "414.4": {
          "expectedTextHash": "1ab13a848785b2d0fa3e398b91a2750b947e47ef8faae4beb185eeaca68f1aa5",
          "actualTextHash": "1ab13a848785b2d0fa3e398b91a2750b947e47ef8faae4beb185eeaca68f1aa5"
        }
      },
      "valid": true,
      "executable": true,
      "validationErrors": [],
      "compilerVersion": 1
    },
    {
      "programId": "stun-binary-state",
      "obligation": "stun_state",
      "evidenceRuleIds": [
        "423.1.a",
        "423.1.a.1"
      ],
      "sourceTextGuards": {
        "423.1.a": "Stunned is a binary state. A Unit is Stunned or it isn't.",
        "423.1.a.1": "A Stunned Unit can not be Stunned again."
      },
      "cases": [
        {
          "when": [
            {
              "fact": "unit_already_stunned",
              "op": "is_true"
            }
          ],
          "verdict": "no",
          "truth": "true",
          "claim": "Stunned is a binary state, and a Unit that is already Stunned cannot be Stunned again; no new Stun action occurs.",
          "evidenceRuleIds": [
            "423.1.a",
            "423.1.a.1"
          ],
          "applicabilityRuleId": "423.1.a.1"
        }
      ],
      "fallback": {